{"$id":"https://github.com/itdojp/private-match-protocol/raw/main/schema/pet-contract-compatibility.v0.2.schema.json","$schema":"https://json-schema.org/draft/2020-12/schema","additionalProperties":false,"properties":{"$schema":{"const":"https://github.com/itdojp/private-match-protocol/raw/main/schema/pet-contract-compatibility.v0.2.schema.json"},"artifact_status":{"const":"experimental"},"compatibility_digest":{"pattern":"^sha256:[0-9a-f]{64}$","type":"string"},"graphs":{"items":false,"maxItems":2,"minItems":2,"prefixItems":[{"additionalProperties":false,"properties":{"artifacts":{"items":{"additionalProperties":false,"properties":{"file_digest":{"pattern":"^sha256:[0-9a-f]{64}$","type":"string"},"path":{"pattern":"^(?!/)(?![A-Za-z]:)(?!.*\\\\)(?!.*(?:^|/)\\.\\.?(?:/|$))[A-Za-z0-9._/-]+$","type":"string"},"role":{"enum":["conformance-case-catalog","conformance-case-schema","error-code-catalog","error-code-schema","executable-result-schema","message-envelope-schema","operation-input-schema","operation-stage","operation-stage-schema","product-handoff","product-handoff-schema","profile-nitro","profile-schema","profile-secretflow","profile-voprf","protocol-binding","protocol-binding-schema","registry","registry-schema"],"type":"string"}},"required":["role","path","file_digest"],"type":"object"},"maxItems":19,"minItems":19,"type":"array"},"contract_version":{"const":"0.1"},"graph_digest":{"pattern":"^sha256:[0-9a-f]{64}$","type":"string"},"graph_id":{"const":"rollback-v0.1"},"selection":{"const":"rollback-only"}},"required":["graph_id","contract_version","selection","artifacts","graph_digest"],"type":"object"},{"additionalProperties":false,"properties":{"artifacts":{"items":{"additionalProperties":false,"properties":{"file_digest":{"pattern":"^sha256:[0-9a-f]{64}$","type":"string"},"path":{"pattern":"^(?!/)(?![A-Za-z]:)(?!.*\\\\)(?!.*(?:^|/)\\.\\.?(?:/|$))[A-Za-z0-9._/-]+$","type":"string"},"role":{"enum":["conformance-case-catalog","conformance-case-schema","error-code-catalog","error-code-schema","executable-result-schema","message-envelope-schema","operation-input-schema","operation-stage","operation-stage-schema","product-handoff","product-handoff-schema","profile-nitro","profile-schema","profile-secretflow","profile-voprf","protocol-binding","protocol-binding-schema","registry","registry-schema"],"type":"string"}},"required":["role","path","file_digest"],"type":"object"},"maxItems":19,"minItems":19,"type":"array"},"contract_version":{"const":"0.2"},"graph_digest":{"pattern":"^sha256:[0-9a-f]{64}$","type":"string"},"graph_id":{"const":"current-v0.2"},"selection":{"const":"current"}},"required":["graph_id","contract_version","selection","artifacts","graph_digest"],"type":"object"}],"type":"array"},"limitations":{"items":{"maxLength":2048,"minLength":1,"type":"string"},"maxItems":16,"minItems":1,"type":"array","uniqueItems":true},"record_type":{"const":"pet-contract-compatibility"},"rules":{"additionalProperties":false,"properties":{"cross_version_mixing":{"const":"fail-closed"},"current_selection":{"const":"complete-v0.2-graph-only"},"forward_inference":{"const":false},"implicit_fallback":{"const":false},"partial_graph":{"const":"fail-closed"},"rollback_selection":{"const":"complete-v0.1-graph-only"}},"required":["cross_version_mixing","implicit_fallback","forward_inference","partial_graph","rollback_selection","current_selection"],"type":"object"},"schema_version":{"const":"0.2"},"version_requirements":{"items":false,"maxItems":2,"minItems":2,"prefixItems":[{"additionalProperties":false,"properties":{"contract_version":{"const":"0.1"},"error_code_catalog_path":{"const":"config/pet-profile-error-codes.v0.1.json","type":"string"},"operation_input_schema_path":{"const":"schema/pet-profile-operation-input.v0.1.schema.json","type":"string"},"operation_stage_path":{"const":"specs/pet-integration/operation-stage-contract.v0.1.yaml","type":"string"},"product_handoff_path":{"const":"handoff/product-decision-engine-port.v0.1.yaml","type":"string"},"profile_registry_path":{"const":"registry/pet-integration-profiles.v0.1.yaml","type":"string"},"protocol_binding_path":{"const":"specs/pet-integration/protocol-binding.v0.1.yaml","type":"string"},"selection":{"const":"rollback-only"}},"required":["contract_version","selection","profile_registry_path","protocol_binding_path","operation_stage_path","operation_input_schema_path","product_handoff_path","error_code_catalog_path"],"type":"object"},{"additionalProperties":false,"properties":{"contract_version":{"const":"0.2"},"error_code_catalog_path":{"const":"config/pet-profile-error-codes.v0.2.json","type":"string"},"operation_input_schema_path":{"const":"schema/pet-profile-operation-input.v0.2.schema.json","type":"string"},"operation_stage_path":{"const":"specs/pet-integration/operation-stage-contract.v0.2.yaml","type":"string"},"product_handoff_path":{"const":"handoff/product-decision-engine-port.v0.2.yaml","type":"string"},"profile_registry_path":{"const":"registry/pet-integration-profiles.v0.2.yaml","type":"string"},"protocol_binding_path":{"const":"specs/pet-integration/protocol-binding.v0.2.yaml","type":"string"},"selection":{"const":"current"}},"required":["contract_version","selection","profile_registry_path","protocol_binding_path","operation_stage_path","operation_input_schema_path","product_handoff_path","error_code_catalog_path"],"type":"object"}],"type":"array"}},"required":["$schema","schema_version","record_type","artifact_status","graphs","rules","limitations","compatibility_digest","version_requirements"],"title":"PET contract version compatibility map","type":"object"}
