{"$schema":"https://github.com/itdojp/private-match-protocol/raw/main/schema/pet-contract-compatibility.v0.2.schema.json","artifact_status":"experimental","compatibility_digest":"sha256:924430de963ccb1207d09fd38a1dc8b4e1aab1f0afa1cfccf6341458871f6962","graphs":[{"artifacts":[{"file_digest":"sha256:73d7398b85a29ebabd9771e63db7cd0febf9aa250aa8776d48fff83303890da4","path":"conformance/pet-profiles/case-catalog.v0.1.json","role":"conformance-case-catalog"},{"file_digest":"sha256:dd853a743c1ff3d467f162ba5d73a8d0744455daf6c093817811d48bc0a271b6","path":"schema/pet-profile-conformance-cases.v0.1.schema.json","role":"conformance-case-schema"},{"file_digest":"sha256:7290214598ca55257132c6511afea15fe8a4b5a86918d8d0d23bcd52d49289e5","path":"config/pet-profile-error-codes.v0.1.json","role":"error-code-catalog"},{"file_digest":"sha256:46a49b8fda8b727ba44b5d54bb12ccc95c4dac7e73bcc11818ff6a3185ccfe73","path":"schema/pet-profile-error-codes.v0.1.schema.json","role":"error-code-schema"},{"file_digest":"sha256:85e1c59350fe2e8aeab514679a832fa983abd86c4d40f960328b5806b1dce2e5","path":"schema/pet-profile-case-results.v0.1.schema.json","role":"executable-result-schema"},{"file_digest":"sha256:ad06c85498ab5a9b1533ba28596bba0f956a4843bd61a854285ef9c15d5099c1","path":"schemas/messages/envelope.v0.1.schema.json","role":"message-envelope-schema"},{"file_digest":"sha256:d8152d50e36362ad4cfcf4f050911f44b90a6cbce6f8b96e2bc7b2f4b028c63f","path":"schema/pet-profile-operation-input.v0.1.schema.json","role":"operation-input-schema"},{"file_digest":"sha256:aa65e4e5ac3cedd03ca99958fbea414232821d70de35f73f8c68c67f047d3df5","path":"specs/pet-integration/operation-stage-contract.v0.1.yaml","role":"operation-stage"},{"file_digest":"sha256:7f645afeed764d3907f5cd2992a50a1caccf4fb2b92d53a7edddadc5b9e070ca","path":"schema/pet-operation-stage-contract.v0.1.schema.json","role":"operation-stage-schema"},{"file_digest":"sha256:277fefa5c549aafff4b34c13f0c7a14091bf25af5a12865ef9e38649c0cffdb3","path":"handoff/product-decision-engine-port.v0.1.yaml","role":"product-handoff"},{"file_digest":"sha256:a298815516a90098238c49746c40743ef9dea8b40592cbe75d76fec6e0c44019","path":"schema/product-decision-engine-handoff.v0.1.schema.json","role":"product-handoff-schema"},{"file_digest":"sha256:0e771ae5b39965476ba42d93ab4f00ec314541e1e45c7fe156348abff10fb1ab","path":"profiles/pet-integration/nitro-enclave.v0.1.json","role":"profile-nitro"},{"file_digest":"sha256:820b119b71e46420d8e864fc48f763cb1dac7cb6bb5e5a752003b19d8f2892fe","path":"schema/pet-integration-profile.v0.1.schema.json","role":"profile-schema"},{"file_digest":"sha256:2f3701adb199c3dcbb0ea5a2dcfb56729ce04ca3629c13c3e3198f3ff2a1be62","path":"profiles/pet-integration/secretflow-kkrt.v0.1.json","role":"profile-secretflow"},{"file_digest":"sha256:a826982fc38ac39c4a0616ad5ff69118d4b887851f530958667889119080cfc9","path":"profiles/pet-integration/voprf-component.v0.1.json","role":"profile-voprf"},{"file_digest":"sha256:423b049cdce59979d7179de9e1997a7abf5788a6f849b4a6b1fde3e5e6b4b432","path":"specs/pet-integration/protocol-binding.v0.1.yaml","role":"protocol-binding"},{"file_digest":"sha256:f3bafeda118d2d4f8e8639ed5ae78694274b2393015ddf84a7fbc6f264aa2a01","path":"schema/pet-protocol-binding.v0.1.schema.json","role":"protocol-binding-schema"},{"file_digest":"sha256:eadf100c2ac78bebd8e39327a825295d4adfdbce0dc7f9c94eef0d46e87f654a","path":"registry/pet-integration-profiles.v0.1.yaml","role":"registry"},{"file_digest":"sha256:768f2e5a080a8ff3a62a66d773520e9de62f8ef2489740b9716e2989c9cb4f5a","path":"schema/pet-integration-profile-registry.v0.1.schema.json","role":"registry-schema"}],"contract_version":"0.1","graph_digest":"sha256:ec50492d34b8e2f8ac0916e1fd64e0654c85c20ba3afa20ba34f7b495632ed8b","graph_id":"rollback-v0.1","selection":"rollback-only"},{"artifacts":[{"file_digest":"sha256:b34a6f8bd0f652d63418485aed9574dde9f4691a8565893670dfeb90ea83e88e","path":"conformance/pet-profiles/case-catalog.v0.2.json","role":"conformance-case-catalog"},{"file_digest":"sha256:6794e24f970a90a10990b6e469ac834ed82173cf8e8c93f43f286a8d736f3b13","path":"schema/pet-profile-conformance-cases.v0.2.schema.json","role":"conformance-case-schema"},{"file_digest":"sha256:1e1be608b5d8d71aaf63981891748611f1c45f0a76d5f5cc90b97fb70810128b","path":"config/pet-profile-error-codes.v0.2.json","role":"error-code-catalog"},{"file_digest":"sha256:c2a3ffb3398f7eefdf027312163b837528cfdde38dfd65370d8c4699fc45958f","path":"schema/pet-profile-error-codes.v0.2.schema.json","role":"error-code-schema"},{"file_digest":"sha256:ecc10ce269b2c406abceebac336f74f8c1396fd779864653538b6311150d168d","path":"schema/pet-profile-case-results.v0.2.schema.json","role":"executable-result-schema"},{"file_digest":"sha256:dd3facde469ee2539137d12527533210aa2014f77e3f18bfbe54a620f04e4e17","path":"schemas/messages/envelope.v0.2.schema.json","role":"message-envelope-schema"},{"file_digest":"sha256:36054fde5ffa210c67abfb2a192528d67f059c20f93ec13e624c158c68ddb4f9","path":"schema/pet-profile-operation-input.v0.2.schema.json","role":"operation-input-schema"},{"file_digest":"sha256:5503bc6fdd994dbf79a7ba4b83167a9fc4b9eeb09ddd677cbfbe24bcb193dcd1","path":"specs/pet-integration/operation-stage-contract.v0.2.yaml","role":"operation-stage"},{"file_digest":"sha256:1d0900fb85332158041211ad7647c690f353b048332f314a971d44f504b0cdaf","path":"schema/pet-operation-stage-contract.v0.2.schema.json","role":"operation-stage-schema"},{"file_digest":"sha256:32270ea25d6778e19834bc1c916611ffe745e2dbba6de615b1bc18fcf74552ca","path":"handoff/product-decision-engine-port.v0.2.yaml","role":"product-handoff"},{"file_digest":"sha256:0869446c480db338aa68e35a9b7f3210887c9817d0cb570eaf1c4d5ea9bc0dc5","path":"schema/product-decision-engine-handoff.v0.2.schema.json","role":"product-handoff-schema"},{"file_digest":"sha256:035106cfe0bab5c1327290d7fc7afe316955bff1dd097f02775d1e4b41fefd23","path":"profiles/pet-integration/nitro-enclave.v0.2.json","role":"profile-nitro"},{"file_digest":"sha256:30404a21accc1a9068e239aede75e9b5f2178b8ae95c7903192ecde801c92528","path":"schema/pet-integration-profile.v0.2.schema.json","role":"profile-schema"},{"file_digest":"sha256:551950c540bc5751de3825625766b7d67d8f70a066b8c77451bc70149a5152cc","path":"profiles/pet-integration/secretflow-kkrt.v0.2.json","role":"profile-secretflow"},{"file_digest":"sha256:136af23eee78eb5a0b9615c920a76d4ca6621e413ea7fa3a5dcc3ebb2281d832","path":"profiles/pet-integration/voprf-component.v0.2.json","role":"profile-voprf"},{"file_digest":"sha256:9b7f49c2a365fdc7b010ea85533512beeef25e44ae0691dd0dea083b5e984928","path":"specs/pet-integration/protocol-binding.v0.2.yaml","role":"protocol-binding"},{"file_digest":"sha256:ed7861f46c96985c49e32b162720bd55cba34e6240be4f1ec711b5d03fb73963","path":"schema/pet-protocol-binding.v0.2.schema.json","role":"protocol-binding-schema"},{"file_digest":"sha256:6b291247c8148fdb1cfc4d0b1c83cd4c24144d9be593f99d10d8620dffeac0d6","path":"registry/pet-integration-profiles.v0.2.yaml","role":"registry"},{"file_digest":"sha256:881aecfc8900dfdf78089a01eda9c1b2a60f533ab9c25e327b5777fbf0bdf4d7","path":"schema/pet-integration-profile-registry.v0.2.schema.json","role":"registry-schema"}],"contract_version":"0.2","graph_digest":"sha256:38603ded97538bb5d54dc56cd0ab884ef1c47b7d74d96bf5f9b953c2a15d19ce","graph_id":"current-v0.2","selection":"current"}],"limitations":["The compatibility map binds public contract files, not a Product implementation.","Rollback is an explicit whole-graph selection and never an implicit fallback."],"record_type":"pet-contract-compatibility","rules":{"cross_version_mixing":"fail-closed","current_selection":"complete-v0.2-graph-only","forward_inference":false,"implicit_fallback":false,"partial_graph":"fail-closed","rollback_selection":"complete-v0.1-graph-only"},"schema_version":"0.2","version_requirements":[{"contract_version":"0.1","error_code_catalog_path":"config/pet-profile-error-codes.v0.1.json","operation_input_schema_path":"schema/pet-profile-operation-input.v0.1.schema.json","operation_stage_path":"specs/pet-integration/operation-stage-contract.v0.1.yaml","product_handoff_path":"handoff/product-decision-engine-port.v0.1.yaml","profile_registry_path":"registry/pet-integration-profiles.v0.1.yaml","protocol_binding_path":"specs/pet-integration/protocol-binding.v0.1.yaml","selection":"rollback-only"},{"contract_version":"0.2","error_code_catalog_path":"config/pet-profile-error-codes.v0.2.json","operation_input_schema_path":"schema/pet-profile-operation-input.v0.2.schema.json","operation_stage_path":"specs/pet-integration/operation-stage-contract.v0.2.yaml","product_handoff_path":"handoff/product-decision-engine-port.v0.2.yaml","profile_registry_path":"registry/pet-integration-profiles.v0.2.yaml","protocol_binding_path":"specs/pet-integration/protocol-binding.v0.2.yaml","selection":"current"}]}
